{
  "schema_version": "1.0.0",
  "experiment_id": "experiment-01",
  "parent_checkpoint_id": null,
  "seed": 12345,
  "budget_units": 20,
  "reward_source": "fn reward(t: Transition) -> Number { return 0.0; }",
  "ppo": {
    "learning_rate": 0.0003,
    "gamma": 0.99,
    "entropy_coef": 0.01,
    "gae_lambda": 0.95,
    "clip_range": 0.2,
    "batch_size": 256
  }
}
